comment,abusive,aggressor,logged_in
"It would be great if you write another one exactly like this, except the part Jin GuangYao makes Lan XiChen sleep. I wonder to see him frightened and scared. It could happen when, you know exposure of Jin GuangYao, when Wei WuXian and Lan Wangji were trying to figure out what Jin GuangYao is trying to do and where did he took Lan XiChen.",0,,
"Excellent! :nosebleed:
Good job!! Really loved it!! The angst at the end: ""I want to say... I love you"" I'm angst trash",0,,
nosebleeds everywhere,0,,
A bittersweet closure to his mourning. Nice story.,0,,
"Holy crap, not something i expected to see at 3 am O.o",0,,
"T______T i cried. im very happy for xichen's happily ever after ending T______T
thanks for the update!",0,,
Give NHS his wish! I didn't knew I needed this but now I want more.,0,,
WWX SMH LOOK AT YOUR POOR HANGUANG-JUN,0,,
I was so excited to see this fic had updated! Ah this chapter was such a rollercoaster with all the happy/fun wedding shenanigans and then the heartbreaking ending had me dead. Wonderfully written! I'm hoping that the ending means next chapter we get some (not so) platonic bed-sharing????,0,,
"<p>OMGOMGOMGOMG. First, this was such a deliciously high-strung, angsty ride. Second, this chapter, them finally admitting and apologizing for everything is PERFECTION. I am tearing up over here! &lt;3</p>",0,,
I CAN'T. sdkfa;jasdf;,0,,
I am totally biting my nails waiting for what happens next!,0,,
"OMG omg omg. You are so masterful! This is going to be like, the best reveal when WY is revealed to be the chef behind the night's creations.",0,,
"Hi. I love this story, and I'm dying to read the rest of it!!",0,,
"This is going to be a great story, thank you in advance, keep the chapters coming.",0,,
I love how you write huaisang and xichen's character in here,0,,
yes. destroy that twink,0,,
"Jesus.

Just...
Jesus. We all need Jesus.

Also, I love this.",0,,
"I will forever hate Jiang Fengmian in every fic as to what he did to Jiang Cheng

I am also soo not liking Wei Wuxian's martyr complex. I sometimes wish to hit him. And I keep wondering why Yanli is always quiet.

Ok sorry about that. I just wish I could take away Jiang Cheng from them and make him happy away from them.Coz he is just too good for them.",0,,
"Jiang Fengmian is a fucking bastard. How can he not realize how hard ChengCheng works to make him proud?
I'm loving this chapter, I look forward to the next update.",0,,
"I'M SO HURT RIGHT NOW. Your JC POV is amazing. My best boi is so real, and so hurt. I wanted to cry. Please Fengmian just go and die, you don't deserve any of your children.",0,,
Sometimes i wished madam yu had took JC and left and never looked back. I still wished that tbh.,0,,
"Duuuuuuuuuuude from the title i thought it was going to be funny but you murdered us all in the very first chapter! How could you bee??? I trusted you (not really, I know better than to trust anyone in the xicheng fandom).",0,,
"Just started reading this, but legit had to stop and take a breath, because I got close to murder during the whole last confrontation lol
WWX shitty â€˜yeah, punch me, as long as you feel better!â€™ martyr attitude pissed me off so much",0,,
JFM speaks his first line and I already hate himðŸ˜¡ðŸ˜¡ðŸ˜¡,0,,
CAN SOMEONE FCKING DECK HIS DAD IN THE FACE OMG JIANG FENGMIAN IS SUCH A PIECE OF SHIT!!!!,0,,
"To be honest, I never hated Jiang Fengmian than he is right here! I was always shutting up about rants against JFM because he doesn't matter to me. YET HOLY-I JUST WANT TO REACH ACROSS THIS SCREEN AND STONE HIM TO DEATH. HOW COULD HE TREAT JIANG CHENG LIKE THAT. ðŸ˜¡ðŸ˜¡ðŸ˜¡

BUT WOW! FIRST CHAPTER IS A BLST. You captured everything so amazingly!",0,,
You have managed to make me cry in the first chapter. Bravo.,0,,
"Fck u JFM and YZY!!! Bdhxhdsbcjsbdbd
How dare you do that do JC. He's you fckng son for christ sakes!!! Bdhcbsbxjc

Sorry I just hate those two. JC deserves better parents. Please let someone be his adopted parents or somewhat like parents please",0,,
You made me cry!!! â™¥ï¸â™¥ï¸,0,,
"man fuck JFM! like cmon! how hard is it to come up with a name fucker could've just said ""sally"" jc would've still used it. god this chapter was so heavy with cry vacuuming wwxs holy shit I'm bi and the last lxc names jc and family eating together. lot to unpack i still wanna punch jfm in the face FUCK THAT GUY. man fuck",0,,
"fuck. Fuck, that last part was such a good catharsis. Thank you. Your writing is phenomenal, your characters so well balanced/so well connected to the way they are in canon but also so well suited to the modern world, and itâ€™s really really wonderful to see.",0,,
"omg, so much to love in this chapter! wwx bsod over the concept of bisexuality and him being bi, plus jzx being a stupid dick, and jc's dad being the worst again! excellent work!",0,,
"
I hadn't known before today that there was a difference between funny vacuuming and tragic vacumming. This chapter hurt me.",0,,
"ok so i am /???"" crying ????????? fuck",0,,
"god, all the chapters are different variants of pure pain. my gut was twisted as i read this T_T altho, jin ling's hyper well-meaning enthusiasm somewhat lightened things...only somewhat. i hurt for chengxian so much T_T",0,,
".... TT-TT

Ah, this fic hurts so much... The way they misunderstood each other, only now realizing... I'm just glad they're getting their chance...",0,,
"Lan Juniors are... superficial and obnoxious, praising WWX for giving his core to JC. And quick to jump to accusations. As a previous commentator noted- following in LWJâ€™s obnoxious example....",0,,
"Yikes, poor penguin indeed... The foreshadowing makes the whole scene incredibly creepy.",0,,
"I can't even say anything cohorent, this fic has just destroyed me. I have read it, and had to sit on it for a while, to just savor how raw it left me. This chapter has just had me breathing real hard for the entirety of it.
The disassociation, the feeling of everything slipping out of control... It broke me, in strangely cathartic way. I can't imagine how much worse and intense this can get.",0,,
"omg JC coming between him and Sect Leader Su ahhhhhh ""you're not doing this again"" AHHHHHHHHHHHHHHHHHHH so many emotions in this chapter ""Granny?!"" *more screaming* I'M FINE! TT_TT",0,,
wow I love this story- so unique and you really made the characters come to life in this modern!AU,0,,
"This chapter is so well-paced and exciting and I love the juniors' cameos, but chengxian (and Jin Ling! This is so painful for him!) continue to break my heart. They're in such a mess and I know it's only going to get messier.",0,,
"AHHHH thank you so much for this update it was EXACTLY what I needed. I'll be honest I don't think I've read a more entertaining, thrilling, and comprehensive telling or retelling of the siege of the burial mounds before. Usually it's dull or confusing or very very long. You did such a great job in my opinion. Thank you for another fantastic chapter",0,,
"Just wanted to drop a comment to let you know that I really si enjoy this work("": thank you for the wonderful read and I cant wait for the next half of the story! just wanted to let you know that there are still people rooting for you and this story!",0,,
I'm going to post a proper reaction later. But I just wanted to let you know that your updates are keeping the original posting dates so it's not moving to the beginning of the tag when you update. People who just check the first page might start missing that you updated. I think you might have to manually change the date when you post a new chapter. :(,0,,
omg xichen please omg. the secondhand embarrassment is so strong. i love him so much this poor hornee man who just wants to dote and love his lover so so so so thoroughly. LOVE IT. I LOVE THIS SO MUCH.,0,,
"Loved it ðŸ˜Š their dumb horny energy is truly outstanding ðŸ˜
And they are so in love with each other ðŸ’—",0,,
I really love this fic. Itâ€™s one of the very few unfinished fics that I actively go back and reread. Looking forward to the next chapter whenever you have a chance to post.,0,,
I'm so sorry about the negative comments <3 this fic is lovely and I've had such a nice time reading it,0,,
"Life is hard (especially given everything) and fic writing is hard too! Kudos to you for wanting to continue this, and Iâ€™m so sorry youâ€™ve had to deal with such negativity.

Ugh the JC reveal was so good and set up the parallels in both of their sacrifices (including the way WWX talks about JC daring to hide it from him - god theyâ€™re both idiots and I love them). Itâ€™s going to be so interesting when they meet again.",0,,
"Oh holy moly this was amazing ðŸ”¥ðŸ”¥ I was initially gonna wait for the next part to come before I started this, but the description was too interesting for me to pass on and here I am XD

Loved it!",0,,
"The way I jumped when I saw the AO3 email. XD

God, this has been such a ride! I'm so excited for the two of them! XD",0,,
"I love how shy JC is! But he is still so good for his Huan-gege.
Your style of writing is very captivating! Looking forward to new chapter â¤ï¸â¤ï¸",0,,
This was absolutely fantastic. Excited for the next chapter! Thanks for sharing. ,0,,
"Wow! Once again you've done it. These 3 chapters were intense. Also, JC's need to self-immolate is bordering on masochism. I mean, you were granted a gift to change not only yourself but in some sense, your past mistakes yet his ridiculously low insecurity prevents him from doing it. I mean c'mon. It's pathetic. Reading this last chapter, I just wanted to shake him and scream ""get your head out the sand and go and grab your destiny"". Ugh. Anyway, thank you for your story",0,,
good..finally u dump those ungrateful n toxic people in ur fam..now lets see if they can run the business like usual or loose all the sales n etc..i hope that wwx will ruin n bamkruot the company to the point of bankruptcy n close it down..coz jc n the nies will not go n buy it off from dem to take over..let someone else do it..,0,,
"Iâ€™ve read the whole series and I have so much emotions now I can not explain. (Add to that that horrible donhua huh)

I wanna punch WWX and LWJ so bad. So so bad. Sorry, but ADHD isnâ€™t excuse for being an asshole brother.

JFM must die the most horrible death. He must DIE.

NMJ and JC do not deserve that kind of the mess. Honestly, NMJ being an angel keeping up with all this bullshit of Jiangs household. No wonder he needed therapy too.

I want them to have a happy ending. I want all other suffer immensely. Yesimmathatbitterbitch.

Thatâ€™s wonderful how you managed to portray all of it so realistically. How dysfunctional family poisons everything surrounding it. That wow. True talent. Thank you ðŸ’™",0,,
wow..u locked n ignored jc out from his own home..in the rain..n den go n run to lwj uses him as a rebound..ugh..wretched brat..,0,,
"Oh, bitch nah!
Wtf wwx, isnâ€™t jc your bf? The hell are you doing going around, fucking another guy? I mean really? Without even attempting to talk it out with jc? My god, why are you like this?",0,,
"Nope. No sympathy fo Jiang Wanyin and Jiang Yanli either. Idk what they did or didnâ€™t know. Are you telling me Jiang Wanyin, eventually growing into an adult, never looked into the specifics of his medical record? And if Jiang Yanli is so great, she wouldnâ€™t always be such a disappointing character in canon and fanon. â€œI didnâ€™t know, Iâ€™m sorry, let me make some soup, busy marrying the man of my dreams so I couldnâ€™t have done anything about your sufferingâ€ whateverðŸŒš
Lol Iâ€™m honestly not a big fan of Yanli so if I were Lan Zhan, Iâ€™d tell Wei Ying what happened. And if I were Wei Ying, Iâ€™d hit IGNORE. Passsssssss
I also realize that Iâ€™m being super harsh but let me live out my fictional RAGE",0,,
Excuse me while i burn a-cheng's parent's house downðŸ˜ I fucking hate them..My poor baby A-cheng ðŸ¥ºðŸ’œ and you have an incredible talent and this fic is amazingly written ðŸ’œAnd i know I'm late but i hope you are feeling better luv.I wish i could come come over and listen to all your problems or just give you a hug.I really doðŸ’œðŸ’œðŸ’œðŸ’œ Take care author.Love you ðŸ’œ,0,,
"Hey, thanks for sharing your work with us! Some of the stuff that was mentioned about it being ok to not know what you want and the feelings of being lost in terms about who you are, really hit home for me, but I never really knew how to articulte those feelings

Side note, I'm really sorry to hear that you're having a rough day. Hope that you're feeling better now and please take care of yourself! (drink lots of water and take nice long naps)",0,,
"This was so good ;-; its almost like... bittersweet in a way? And I appreciate that love isnt some automatic cure, but it certainly helps make everything a little bit better (and I hope one day you (really, all of us lmao) get an lxc of your own)
I'm sorry that you had such a bad day and I hope you feel better and that venting like this helped some <3 it's okay to not know who you are, and to take some time to try to establish who you want to be and what you want from life, away from the influences of other people, including your parents and those you want to please (and trying to come to terms with the fact that you being happy and satisfied and content is more important than making everyone else around you happy and trying to make them proud of you, and that there are ppl in your life who love you regardless of what you can do for them and will be proud of you for finding yourself(I... haven't quite achieved this lol))
Stay healthy and safe! I hope you have a better day today :)
Also I love Over and epik high omg and it suits jc so well?? I never realized wow",0,,
"I'm so glad they resolved all misunderstandings and ended up together!
Thank you for writing this story ðŸ’–ðŸŒº",0,,
"Thank you for sharing this amazing fic, I enjoyed reading it a lot and I appreciate the extra work putting in it by adding the images as well ðŸ¥°

Good job fixing your relationship by your drunk twittering, jc, huan-ge deserves all your love, spoil him! ðŸ˜ŠðŸ’œðŸ’™",0,,
"
Awwwwwwwwwww!",0,,
"
omg cries LOVELY ENDING FOR THE LOVELIEST PEOPLE",0,,
"Awww very sweet ending, loved this! Thanks so much for sharing~!",0,,
"oh!!!!!!
this really had an interesting writing style and sequences, and i do feel really intrigued by this plot and the way it was written out.

and the ending!!!
it really hit the peak!!",0,,
"This is very poignant. He starts out trying to undo what he did then just finds himself doing his best to get home to the person who matters most. And all the versions he meets, just as tragic, make him more determined. Love it.",0,,
"This is so terribly, hauntingly beautiful. I love this to absolute pieces. I love the open ending, how over time Wei Wuxian slowly comes to realise that even if they can not live what they had dreamt of, what they felt for each other won't be devalued and remains just as precious.

There are so many brilliant phrases here. Your writing style is lovely. But especially the two ending lines of each of the quote-styled portions. All of them are amazing. Thank you so much for this gem of a piece.",0,,
Aww the dimension hopping one!,0,,
"
Oooh exciting! I can't wait to see where the rest of this story goes :D",0,,
"
They had a CHAINSAW attached to their HAND and then used a STEEL CABLE like a WHIP????
This is the content I live and breathe for, tyvm",0,,
"
This was so heartwarming <3",0,,
Alien world seems deeply unpleasant. I'd also jump into a weird rift to escape it ><,0,,
"
DETONATE THE BREACH!!!!!!
Also the image of wangxian just covered in whatever pickled kaiju body parts xue yang had is kind of funny",0,,
"Yes good perfect. Happy ending. Amazing. I really enjoyed this, thanks so much for sharing :D",0,,
"hhahahahaha OMG THIS IS THE BEEEEEEEEEEST!!
LOOOOOOOOOOOOVED IT ALL!!
fengmian really see that coming and still there is nothing he can do about it!!
thanks for sharing!
â¤â¤â¤â¤â¤â¤â¤â¤â¤â¤
cant wait for more!",0,,
"This made me cackle. My cheeks hurt because I had a smile the whole time I was reading. I canâ€™t even say what parts are my favorite because every time I decide, I read something funnier. JFM sitting up in bed in a cold sweat friggin kills me ðŸ˜‚ðŸ˜‚",0,,
"
I saw your username and i click
I love this its so cute
Can you blame them tho, a-cheng is cute",0,,
"
yes they won't let him fall prey to the sharks in the ocean ðŸ˜‚ðŸ˜‚",0,,
"It is a credit to your skills as a writer that you had me smiling,
laughing, and THOROUGHLY engrossed in a fic that wasn't Wangxian centric.

Kudos and thank you.",0,,
hahhahah thank gods for yzy for having the brain in the family!!!,0,,
"
SCREAMS THE DAD-SON RECONCILATION IS AMAZING JDJDJDJDDHDHDDB

i love this so much!!!!!!!!!",0,,
"This was beautiful and and I'm glad that LXC joined forces with WWX and JFM.

This is the only JFM that I like, other than that the canon JFM can go fuck himself.

Take care, drink some water, and have a nicd day/night!!",0,,
"I had SO MUCH fun with this, and I love how you closed it. Full circle.
People hate JFM? I haven't been that long in the fandom so I wouldn't know. It seems rather unfair, I mean obviously he had his flaws but I don't think he is hateful. Besides, a common theme in mxtx's works is that flaws are inevitable in anyone",0,,
"I literally laughed out loud several times while reading this, I think it cured my depression. ðŸ’–ðŸ’–ðŸ’–",0,,
Oh this is too wonderful AND THE ENDING..???? THAT PHONE CALL?? HAHAHAHA ABSOLUTELY FANTASTIC! What a good ending hahahahahaha thank you for this!!! I had so so so much fun reading this,0,,
Great beginning. Looking forward to more,0,,
"oooh long fic and slowburn? super excited for this!

love the first chapter, can't wait for the next!",0,,
"I am loving this! I don't always get in on the ground floor for an epic like this, but this concept is pushing all the right buttons, so I am all in! Super excited to join you on this epic journey of slowburn and, I can only hope, copious mutual pining (which is my jam).",0,,
"
I literally drop everything when I get an email that youâ€™ve posted, I trust you that much, so I will definitely be along for the ride. Amazing first chapter, as always",0,,
"
Everything ab this is glorious, I cannot wait to see how it develops. Thank you so much ðŸ’ž",0,,
You just made me cry on the first chapter! How dare you!?,0,,
Eeee! what a thrilling first chapter!,0,,
"
I am here and ready for the queer",0,,
I loved this! The way you described everything was amazing. The way the war ended tho ðŸ˜ðŸ˜ so good. I canâ€™t wait for the next one!,0,,
"
I read both the chapters together and this fic is so good. can't wait for Sunday to come ðŸ˜–",0,,
"Once again a fantastic chapter, so looking forward to the ""Wedding"" thank you for this amazing story xx",0,,
